{
  "id": "policy_exemption_audit",
  "manifest_id": "policy-exemption-audit",
  "name": "Policy Exemption Audit",
  "version": "0.1.0",
  "channel": "beta",
  "description": "Advisory mod that surfaces evidence claiming a policy exemption/waiver/accepted-risk (exempt/waiver/wontfix/accepted risk/policy exception/...) so a policy owner can re-approve it.",
  "family": "governance",
  "advises_on": "Policy-exemption/waiver/accepted-risk CLAIMS (exempt/waiver/grandfathered/wontfix/accepted risk/policy exception/suppress finding/...) in title + body + evidence excerpts.",
  "consumes": [
    "title + body",
    "evidence excerpts"
  ],
  "emits": [
    "advisory_governance_result",
    "routing_hint",
    "suggested_review_question"
  ],
  "em_safe": {
    "non_authoritative": true,
    "forbidden_actions": [
      "write_canonical_decision",
      "approve_signoff",
      "resolve_compliance",
      "create_blocking_ci_result",
      "bypass_governance_policy",
      "mutate_source_evidence",
      "collapse_confidence_score"
    ]
  },
  "enablement": {
    "default_enabled": true,
    "trust_gated": false
  },
  "requirements": [
    "The neutral evidence stream (AdapterEmission) — no credentials, no live network."
  ],
  "ui": {
    "advisory_only": true,
    "card_blurb": "Surfaces policy-exemption/waiver claims for re-approval; a routing signal, never a finding-of-record."
  },
  "references": [
    {
      "kind": "scope",
      "url": "mods/policy_exemption_audit/README.md"
    },
    {
      "kind": "mod-safety-contract",
      "url": "mods/README.md"
    },
    {
      "kind": "adr",
      "url": "docs/adr/0008-integrations-are-evidence-adapters-not-state-authorities.md"
    }
  ]
}
